URL,Name,Price,Rating,Reviews
/ADISA-Laptop-Backpack-Office-College/dp/B0BPVLXD53,ADISA 32L Large Laptop Backpack Office Bag College Travel Back Pack with rain Cover (Grey),₹599,3.8,143
/Gear-Black-Laptop-Backpack-LBPASPIRE0104/dp/B075MK4TXP,Gear Aspire 30L Water Restant Office Laptop Bag/Backpack for Men/Women/(Black),"₹1,099",4.3,More Like This
/Lenovo-15-6-Inches-Everyday-Backpack/dp/B08R7RPVJF,"Lenovo 15.6"" (39.62cm) Slim Everyday Backpack, Made in India, Compact, Water-resistant, Organized storage:Laptop sleeve,tablet pocket,front workstation,2-side pockets,Padded adjustable shoulder straps",₹649,4.4,"3,049"
/gp/bestsellers/computers/1375464031/ref=sr_bs_3_1375464031_1,"Genie Glitter Backpack for Women - 3 compartments, Laptop Bags for Girls, Stylish and Trendy College Backpacks for Girls, Water Resistant and Lightweight Bags for Office and Travelling Purpose.",₹889,4.3,More Like This
/GEAR-Black-Blue-Backpack-years/dp/B019HA8AYG,Gear CarryOn 16L Foldable Water Resistant School Bag//Backpack/College Bag for Men/Women - Blue Black,₹199,3.7,"6,453"
/Wesley-Milestone-Waterproof-Backpack-Business/dp/B085S444JV,"Wesley Milestone 2.0 Casual Waterproof Laptop Backpack/Office Bag/School Bag/College Bag/Business Bag/Travel Backpack (Dimensions:13x18 inches) (Compatible with 39.62cm(15.6inch laptop) 30 L, Charcoal black",₹598,4.3,"10,944"
/Gear-Classic-Leather-Backpack-LBPCLSLTH0201/dp/B07G4F6XFH,Gear Classic 20L Faux Leather Water Resistant Anti Theft Laptop Bag/Backpack for Men/Women-Brown,₹988,4.4,More Like This
/Safari-Backpack-Resistant-Polyester-Travelling/dp/B09B26VHXV,"Safari Flash Casual Backpack, 26 ltr Water Resistant Travel Bags| Weight Polyester Bagpack for Men and Women, Spacious Shoulder Bag for College, Office, Travelling and Camping",₹799,3.8,More Like This
/Half-Moon-Backpack-Luggage-Compartment/dp/B09VCLZ3K4,Half Moon Large 37L Laptop Bag Backpack for menं Women Boys and Girls Luggage Travel Bags with 17.3 inches Laptop Compartment & Rain Cover,₹749,3.9,More Like This
/Lavie-Sport-Duffle-Luggage-Trolley/dp/B097RJ22Q3,Lavie Sport Lino Large Size 63 cms Wheel Duffle Bag for Travel | Travel Bag with Trolley,"₹1,199",4.0,More Like This
/ZIPLINE-Polyester-Backpack-Children-Daypack/dp/B07XVMR33Q,Zipline Unisex casual polyester 36 L Backpack School Bag Women Men Boys Girls children Daypack College Bag Book School Sports Bag Weekend Bag,₹834,4.0,More Like This
/Safari-Laptop-Backpack-Resistant-Fabric/dp/B09B25Z8M2,"Safari Quill Laptop Backpack 26 Ltrs Water Resistant Fabric - Black, L (QUILL19CBBLK)",₹849,3.9,More Like This
/Safari-Laptop-Backpack-Resistant-Fabric/dp/B09B28TKLG,"Safari Quill Laptop Backpack 26 Ltrs Water Resistant Fabric - Blue, L (QUILL19CBBLU)",₹849,4.0,More Like This
/Wesley-Milestone-Waterproof-Backpack-Business/dp/B07PLKV6D1,Wesley Milestone 15.6 inch 25 L Casual Waterproof Laptop Backpack/Office Bag/School Bag/College Bag/Business Bag/Unisex Travel Backpack,₹497,4.3,"12,764"
/ADISA-BP005-Weight-Casual-Backpack/dp/B07F3X45WZ,ADISA Light Weight Laptop Backpack 32 Ltrs,₹499,4.0,"5,861"
/POLESTAR-Vintage-Laptop-Backpack-bagpack/dp/B081GSQ9D9,"POLESTAR Vintage 15.6 inch 32 LTR Casual Laptop Backpack/Office Bag/School Bag/College Bag/Business Bag/Unisex Backpack, Water Resistant and Light Weight, 1 year Warranty",₹549,3.9,More Like This
/NORTH-ZONE-Waterproof-Backpack-Dimensions/dp/B0BS6QQZYN,NORTH ZONE Casual Waterproof Laptop Backpack/Office Bag/School Bag/College Bag/Business Bag/Travel Backpack (Dimensions:13x18 inches) (Compatible with 39.62cm(15.6inch laptop) 30 L,₹569,4.0,More Like This
/Backpack-Small-Black-Water-Repellant/dp/B088XB5XY8,"Mi Step Out 12 L Mini Backpack (Small Size, Black, Water Repellant)",₹398,4.1,"9,007"
/gp/bestsellers/shoes/1983354031/ref=sr_bs_2_1983354031_1,Lavie Women's Ushawu Satchel Bag | Ladies Purse Handbag,"₹1,059",4.1,More Like This
/Step-Backpack-Small-Water-Repellant/dp/B088XH1BP7,"Mi Step Out 12 L Mini Backpack (Small Size, Dark Blue, Water Repellant)",₹398,4.1,"9,007"
/ADISA-Laptop-Backpack-Office-College/dp/B0BPVCBFM7,ADISA 32L Large Laptop Backpack Office Bag College Travel Back Pack with rain Cover (Green),₹599,3.8,143
/Gear-Vintage2-Leather-Backpack-LBPVG2LTH1901/dp/B07G4F3758,Gear Vintage2 Anti Theft Faux Leather 18 cms Tan Laptop Backpack,₹836,4.3,More Like This
/WILDHORN-Backpack-Compartment-Business-Stitching/dp/B09QL66G55,"WILDHORN 31L Laptop Backpack for Men/Women I Fits upto 15.6"" Laptop I Waterproof I Travel/Business/College Bookbags",₹599,4.0,More Like This
/Casual-Backpack-Charging-Laptop-Compartment/dp/B07J46KLFP,"Fur Jaden 15.6 Inch Laptop Backpack 25 LTR Bag for School, College and Office with USB Charging Port",₹499,3.9,More Like This
/TRUE-Emperor-Anti-Theft-backpack-charging/dp/B0BYB631NR,"TRUE HUMAN® Emperor Anti-Theft Pocket backpack With USB charging Port Laptop,office,college,travel bag for men and women(Epower)",₹649,3.6,More Like This
/Expandable-Backpack-Water-resistant-Business-Charging/dp/B0B6FNB898,Arctic Hunter Laptop Bag Expandable Backpack for 16 inch Lapotp 40L Travel Backpack Water-resistant Business School Backpack with USB Port for Men and Women,"₹3,514",4.5,More Like This
/Half-Moon-Resistant-Backpack-Compartment/dp/B0BLVQ9NTD,Half Moon Strike 35L Unisex Spacious School/Laptop/College/Office Travel Backpack Bag for Men Women Boys & Girls with 15.6 inch Padded Laptop Compartment & Multiple Pockets,₹649,3.8,More Like This
/Gear-Vintage2-Leather-Backpack-LBPVG2LTH0101/dp/B07G44G1DC,Gear Vintage2 28L Faux Leather Water Resistant Anti Theft Laptop Bag/Backpack for Men/Women-Black,₹990,4.4,More Like This
/ADISA-Laptop-Backpack-Office-College/dp/B0BPTV3795,ADISA 32L Large Laptop Backpack Office Bag College Travel Back Pack with rain Cover (Black),₹599,3.8,143
/Urban-Tribe-Laptop-Backpack-Havana/dp/B01LXNNFDF,"URBAN TRIBE Havana Backpack for Men & Women | Laptop Bag 15.6 inch | Office Work/Casual/College Bag | Black, 27L",₹999,3.9,More Like This
/Mokobara-Backpack-litre-Brown-laptop/dp/B095PC3QPV,"MOKOBARA Backpack 15.5"" Inch Laptop Backpack For Women (16 litres ) Improved (2022 - Model)","₹4,499",4.3,More Like This
/AirCase-C34-Laptop-Backpack-Women/dp/B07QN4KXWG,"AirCase Laptop Bag Backpack Case Pouch for Laptop Backpack for Men & Women,Premium Vegan Leather",₹929,3.8,806
/Gear-Vintage2-Leather-Backpack-LBPVG2LTH0501/dp/B07G4HH78P,Gear Vintage2 28L Faux Leather Water Resistant Anti Theft Laptop Bag/Backpack for Men/Women-Navy,₹970,4.4,More Like This
/POLESTAR-backpack-Backpack-College-Students/dp/B08X2KRL8B,"POLESTAR Leader 34 L Bag for College, School, Office, Casual Multipurpose Backpack with 15.6"" Laptop Compartment, Water Resistant, Unisex Design, Stylish & Durable, 1 Year Warranty",₹599,4.1,More Like This
/ADISA-Laptop-Backpack-Office-College/dp/B09TPVD964,ADISA 15.6 inch Laptop Backpack Office Bag College Travel Back Pack 32 Ltrs (z-Teal),₹499,3.9,806
/Gear-Expandable-RainCover-Grey-Black-TLPTURBO00401/dp/B097KDRZ67,Gear Turbo 45L Expandable Water Resistant Antitheft Laptop Bag/Backpack/Briefcase for Men/Women with RainCover (Grey),,4.4,More Like This
/PALAY%C2%AE-Shoulder-4-Zipper-Pockets-Adjustable/dp/B08SWGFBNT,"Palay Waist Bag For Unisex With Adjustable Strap, Waterproof Fanny Pack Stylish Chest Bag Bum Bag With 4-Zipper Pockets For Travel Party Festival Running Hiking",₹584,4.4,More Like This
/Impulse-rucksack-75-backpack-trekking/dp/B09T9XDQ99,Impulse rucksack bags 75 litres travel bag for men tourist bag for travel backpack for hiking trekking Bag for men camping thames blue bag with 1 Year Warranty,"₹1,244",4.0,More Like This
/HOT-SHOT-032-Preschool-Waterproof/dp/B0BRSKKZ1W,HOT SHOT Kids Bag 032|Unicorn Bag|School Bag|2TO5 Years|BOY & Girl|12 Liters Preschool & Nursery Waterproof Plush Bag,₹287,3.9,More Like This
/TRUE-HUMAN-Anti-Theft-backpack-combination/dp/B09VCHV6T5,"TRUE HUMAN® Emperor Anti-Theft backpack with combination lock Laptop bag,office bag for Men and Women | College Bags for Girls & Boys (Zyden)",₹649,3.7,More Like This
/American-Tourister-Polyester-Compartment-Backpack/dp/B0BV75WFJP,"American Tourister Zork Polyester 2 Compartment Laptop Unisex Backpack (Black,Frsz)","₹3,970",3.0,More Like This
/Vivinkaa-Womens-Sling-Bag-Blue/dp/B077WSKG53,"Vivinkaa Sling Bag for Women, Bags for Women, Sling Bag, Purse for Women, Sling Bag for Women Stylish, Sling Bag for Girls, Women Sling Bag, Bag for Girls - Indigo",₹549,3.8,"1,900"
/DZert-Girls-Polyester-White-Backpack/dp/B07H1BPCGQ,DZert Clasy Laptop Bag College Bag for Boys Girls 21 L Nevy Blue,₹339,3.8,More Like This
/Wooum-Anti-Theft-Laptop-Bag/dp/B0BYP7SJ4Q,Wooum Anti Theft Laptop Bag - Backpack For Laptop and Tablet of 15.6 Inch Thick Padded Compartment - Light Weight - Water Resistance – Anti Theft (Black),₹474,4.8,More Like This
/Wildcraft-Green-Casual-Backpack-11650-Green/dp/B079DV66TY,Wildcraft 29.5 Ltrs Green Casual Backpack (11650-Green),₹998,4.1,More Like This
/WILD-MODA-Womens-Shoulder-Turquoise/dp/B099PLT91X,"WILD MODA Women's Shoulder Bag, Set of 1",₹849,4.2,More Like This
/Okami-ZenPack-Minimal-Messenger-Briefcase/dp/B0BVZT69JN,Okami ZenPack UNO Minimal Laptop Messenger Bag X Briefcase,"₹1,999",4.3,19
/Motherly-Diaper-Bags-Travel-Basic/dp/B07PKQ3WJZ,motherly Diaper Bags for Mom Travel Basic Edition (Navy Blue),"₹1,549",4.5,"2,485"
/Storite-Leather-Sling-Bag-Brown/dp/B08TR8RMNH,"Storite Stylish Multi-Pocket Small Sling Cross Body Travel Messenger One Side Shoulder Bag for Men & Women (Brown, 20.5x9x16.5cm)",₹798,4.0,More Like This
/gp/bestsellers/shoes/1983356031/ref=sr_bs_1_1983356031_1,Lavie Women's Betula Medium Tote Bag | Ladies Purse Handbag,₹959,4.1,More Like This
/NETTIE-Cotton-Carry-Strap-Drawstring/dp/B08LBT1R9J,NETTIE Cotton Carry Bag with Strap and Drawstring for Yoga Mat- Big Size,₹198,4.1,"1,067"
/Priority-ARC-Red-Polyester-Trolley/dp/B08HHD4T6W,Priority ARC 56 cm Red Polyester 2 Wheel Duffle Trolley Bag | Travel Luggage for Men & Women,₹411.86,4.0,More Like This
/F-Gear-Milestone-Casual-Laptop-Backpack/dp/B08FX1R6WY,F Gear Milestone Olive Casual 20 Ltrs Laptop Backpack (3376),"₹1,071",4.0,More Like This
/Nishi-Backpack-Waterproof-Stylish-College/dp/B0BR9W54MW,"Nishi Medium Kids Backpack Waterproof Backpack, Girls & Women Stylish Trendy College, School & College Bag Black",₹369,3.3,More Like This
/Gear-Bounce-Backpack-Grey-Orange-BKPBOUNCE0604/dp/B097KCLF5F,Gear Bounce 27 Ltrs Water Resistant School Bag/Backpack/College Bag for Men/Women-Grey Orange,₹615,3.6,422
/ADISA-BP005-Weight-Casual-Backpack/dp/B07D8ZLTT9,ADISA Light Weight Laptop Backpack 32 Ltrs,₹499,4.0,"5,861"
/Classic-Leather-Laptop-Backpack-LBPCLSLTH1901/dp/B07G4CYC74,Gear Classic 20L Faux Leather Water Resistant Anti Theft Laptop Bag/Backpack for Men/Women-Tan,₹990,4.4,More Like This
/NORTH-ZONE-Lightweight-Backpacks-Stylish/dp/B0BL3SPN16,NORTH ZONE Lightweight school bags Backpacks for Boys Girls Stylish men and women Casual Travel Laptop Bag College office,₹568,3.9,More Like This
/SKYTONE-Cosmetic-Bag-Cosmetics-Organizer/dp/B0BV358QKF,"SKYTONE 12cms Large Capacity Cosmetic Travel Bag, Women's Makeup Travel Bag Portable Leather Cosmetics Bag, Makeup Storage Bags with Handle and Divider, Wide Opening Cosmetic/Makeup Organizer (L_Pink)",₹749,3.9,138
/Lunars-Router-Resistant-Raincover-Organiser/dp/B08YR63B9M,"Lunar's 35 L Laptop Office/School/Travel/Business Backpack Water Proof - Fits Up to 15.6 Inch Laptop Notebook, With Raincover, Inside Organiser and 1 Year Warranty (All)",₹849,3.8,More Like This
/PAZZO-Alto-40L-Casual-Backpack/dp/B07VT3F795,"PAZZO Alto 40L Casual Backpack - 3 Compartment Travel Backpack, College|School Bag with 1 Year Warranty",₹849,4.0,More Like This
/Safari-Overnighter-Resistant-Travelling-All-Purpose/dp/B097JM98M1,"Safari Seek 32 Ltrs Overnighter Travel Laptop Backpack (Blue), Water Resistant Spacious Bag for Travelling and Camping, All-Purpose Bag for Business & Leisure","₹1,899",4.3,More Like This
/Genie-Flamenco2-Backpack-Compatible-Resistant/dp/B08YF1XJXY,"Genie Flamenco Laptop Backpack for Women, 16 inches Office Bag, Sky Blue Stylish and Trendy Bag for Office and College",₹799,4.4,"2,995"
/Gear-DOUBLE-Resistant-Backpack-Navy-Tan/dp/B0BTJ2T26W,Gear DOUBLE DECKER 31L Water Resistant Laptop Bag/Backpack/Office Bag for Men/Women (Navy-Tan),"₹1,482",4.0,1
/Gear-Colorado-Navy-Laptop-Backpack/dp/B097K6SPH7,F Gear Colorado Navy Lmn yelw 39 Ltrs Laptop Backpack (3813),₹999,4.2,More Like This
/Wildcraft-Polyester-Black-Laptop-8903338054290/dp/B012D4QKHW,Wildcraft 44 cms Polyester Black Laptop Bag (8903338054290),"₹1,589",4.3,More Like This
/Skybags-Backpack-Drawstring-SK-BPDRNT3BLK/dp/B0BFXMRH19,"Skybags Drip NXT 03 Unisex Daypack Backpack with Drawstring Pocket, Black, SK BPDRNT3BLK","₹1,890",4.1,More Like This
/BP1501-15-6-inch-Gaming-Laptop-Backpack/dp/B081RLHHCY,Asus ROG BP1501 39.62 cm (15.6-inch) Gaming Laptop Backpack (Black),"₹1,499",4.3,925
/Fostelo-CATLIN-Womens-Handbag-Maroon/dp/B079MD5F7R,Fostelo Handbag For Women And Girls | Ladies Purse Faux Leather Satchel Bag | Wedding Gifts For Women | Women 3 Compartments Bag | Travel Purse Hobo Bag | 5 Pockets Shoulder Bag,₹669,4.1,More Like This
/Wooum-Resistant-Material-Messenger-Compartment/dp/B09KV7Y3KL,Wooum Water Resistant Material Sling Bag/One Side Bag/Shoulder Bag/Messenger Bag/Office Messenger Bag/Travel Side Bag with 14.1 Inch Laptop Compartment -,₹474,4.0,261
/BAG-CORNER-Travel-Clothing-Duffel/dp/B0B6VNJ3YG,BAG CORNER Travel Woman and Clothing Duffel Bag (Ten),₹799,4.1,More Like This
/gp/bestsellers/luggage/1984990031/ref=sr_bs_7_1984990031_1,"Amazon Brand - Solimo Rain & Dust Cover for Backpack (30 Litres, Black)",₹209,4.2,"8,472"
/Deal-Polyester-Backpack-Computer-Resistant/dp/B08RC39B71,"The Deal Men's 15.6 Inch Polyester Casual Laptop Backpack, Travel Computer Bag Water Resistant College Work School Bag (Blue)",₹399,3.4,More Like This
/Casual-Waterproof-Laptop-Backpack-College/dp/B0C3XG81XS,"YASH Bag for Boys and Girls Blue Color, 15.6 inch 25 L Casual Waterproof Laptop Backpack/Office Bag/School Bag/College Bag","₹29,499",,M.R.P:
/Hammonds-Flycatcher-Brown-Mens-Laptop/dp/B01LYDRI9V,"Hammonds Flycatcher Genuine Leather Laptop Bag for Men/Office Bag for Men, Brown | Fits Upto 16 Inch Laptop/MacBook | Leather Bag with Shoulder Straps | Laptop Messenger Bag/Leather Bag for Men","₹2,899",4.4,"2,413"
/uppercase-Backpack-2300EBP1-repellent-sustainable/dp/B0B69M182Q,"uppercase Medium 17 Ltrs Vegan Leather (upto 14 inch) Laptop Backpack 2300EBP1 3x more water resistant sustainable bags with rain proof zippers for Men, Women, Boys and Girls, 750 Days warranty","₹1,600",4.1,More Like This
/Red-Lemon-Shoulder-Resistant-Electronic/dp/B0BT82BKCN,Red Lemon Arctic Hunter Mens Small Sling Bag Chest Bag Shoulder Bag Mobile Bag Side Bag with Earphone Port Water Resistant for Everyday Use Small Items and Small Electronic Product (Black),"₹1,299",3.6,6
/Pqwata-Capacity-Portable-Foldable-Weekender/dp/B09YRZ3TLY,"Pqwata Gym Bag, Travel Bag Sport Duffel Bag, Large Capacity Portable Foldable, Carry Luggage Bag for Weekender Sports, Vacation for Men Women (Multy Colour)",₹799,4.5,More Like This
/ASIAN-Sling-Bag-women-Handmade/dp/B09SXRZ7FW,ASIAN Sling Bag for Women - Handmade Bags for Females - Jute and Indian Fabric Slings - Side Bags for Mobile Phones and Wallets (Black),₹224,3.6,86
/Gear-Polyester-Laptop-Backpack-LBPECO1000109/dp/B012NW1H1I,Gear ECO 1 Black Orange Red Laptop Backpack,₹759,4.3,More Like This
/Hammonds-Flycatcher-Genuine-Leather-Messenger/dp/B07MDTVDQH,"Hammonds Flycatcher Genuine Leather Laptop Bag for Men/Office Bag for Men, Brown | Fits Upto 14 Inch Laptop/MacBook | Leather Bag with Shoulder Straps | Laptop Messenger Bag/Leather Bag for Men |","₹2,389",4.4,More Like This
/Storite-Bag-Shoulder-Compartment-Brown/dp/B0BJ6GK6S4,"Storite Pu Leather 46 Cms Travel Duffle Bag Sports Gym Shoulder Handbag for Men Outdoor Weekend Bag for Women with Shoe Compartment Luggage Bag (Brown, 46 x 25.5 x 25.5 Cm)",₹598,3.9,More Like This
/FUR-JADEN-Backpack-Organizer-Compartments/dp/B0BQYKTDCK,"FUR JADEN Faux Leather 15.6 Inch Premium Laptop Backpack 32L with Internal Organizer, 2 Large Compartments","₹2,199",4.6,More Like This
/bg1905-Capacity-Laptop-Travelling-Backpack/dp/B082MKHDJ1,TSPARK Red Lemon bg1905 15.6 inch 35 LTR Capacity Laptop Bag for Men Travelling Hiking Backpack for Men and Women,"₹2,949",4.3,More Like This
/Backpack-Colleges-Luggage-Waterproof-Stylish/dp/B09GYGCK54,"URBAN CARRIER Unisex Waterproof Medium Laptop Backpack for School and Colleges (Grey, Large, 45 Liters)",₹559,3.9,More Like This
/Birthday-Popper-Unicorn-Drawstring-Return/dp/B097FSPNCS,Birthday Popper Drawstring Sack Bag (Set of 15) Birthday Return Gifts for All Age Group,₹599,4.0,795
/ADISA-Laptop-Backpack-Office-College/dp/B0BVRJYD9Q,ADISA 32L Large Laptop Backpack Office Bag College Travel Back Pack with rain Cover (Navy),₹599,4.0,22
/EVRUM-Business-Protection-Crossbody-Waterproof/dp/B0BX6VKQ35,"EVRUM Sling Bag For Men CrossBody Backpack For Men Women, Anti-Theft Chest Bag With USB Charging Port, Waterproof Casual Shoulder Bag Travel Hiking Sling Backpack Carbon Fiber","₹1,619",4.9,70
/NISUN-Zipper-Sling-Black-Grey/dp/B09BZNTFLX,"NISUN Stylish Nylon 7 Zipper Multi Pocket Small Sling Cross Body Travel Messenger One Side Shoulder Bag For Men Women (Black & Grey,21x27x10.5 cm)",₹598,4.0,More Like This
/Arctic-Fox-Liters-Chrome-Backpack/dp/B08DD7S67G,Arctic Fox 27 Liters Chrome Black 15 Inch Laptop Backpack,"₹1,599",4.5,More Like This
/Red-Lemon-Backpack-Accessories-Organiser/dp/B0C2KRH268,"Red Lemon Swiss Cut Design 15.6 Inch Smart Laptop Backpack Bag With USB Charging Port, Anti Theft Pocket and Accessories Organiser for Men Women Boys Girls","₹1,899",4.4,More Like This
/Birthday-Popper-Avengers-Drawstring-Return/dp/B097F8CW71,Birthday Popper Drawstring Sack Bag (Set of 15) Birthday Return Gifts for All Age Group,₹589,4.0,795
/Half-Moon-Waterproof-Backpack-Students/dp/B0BQFVH29F,Half Moon 35 L Casual Waterproof Laptop Bag/Backpack for Men Women Boys Girls/Office School College Teens & Students with Rain Cover (18 Inch) (Sky Blue),₹599,3.6,More Like This
/Tinytot-School-Backpack-College-Multipurpose/dp/B09C5JVWCW,Tinytot School Bag School Backpack College Backpack Travel Backpack Office Backpack Multipurpose Backpack Picnic Bag for Boys & Girls,₹589,4.3,More Like This
/Safari-Formal-Backpack-Anti-Theft-VAULT19CBBLK/dp/B07XSTR69N,"Safari 48 Cms Black Formal/Office/Laptop Backpack With Anti-Theft, Lock, Usb And Rfid (Vault19Cbblk)","₹1,396",4.0,More Like This
/Martucci-Laptop-Backpack-College-Reflective/dp/B0B7DT6HY3,Martucci Large 35 L Backpack Spacy Unisex/College/School/Travel Backpack with Rain Cover and Reflective Strip,₹746,4.0,More Like This
